{
  "$schema": "../schema/bank.schema.json",
  "instrument": "ms16",
  "version": "0.1.0",
  "status": "experimental",
  "title": {
    "zh-CN": "MindScope 16 型人格题库",
    "en": "MindScope 16-Type Item Bank"
  },
  "license": "CC-BY-SA-4.0",
  "source": {
    "zh-CN": "MindScope 项目自编（2026）。尚未经过常模与效度验证，结果仅供自我了解参考。不是官方 MBTI 量表。",
    "en": "Written by the MindScope project (2026). Not yet validated against norms; results are for self-reflection only. Not the official MBTI instrument."
  },
  "scales": {
    "likert7": {
      "points": 7,
      "labels": {
        "zh-CN": [
          "完全不同意",
          "不同意",
          "有点不同意",
          "中立",
          "有点同意",
          "同意",
          "完全同意"
        ],
        "en": [
          "Strongly disagree",
          "Disagree",
          "Slightly disagree",
          "Neutral",
          "Slightly agree",
          "Agree",
          "Strongly agree"
        ]
      }
    }
  },
  "scoring": {
    "engine": "bipolar-likert@1",
    "balancedThreshold": 0.1,
    "bands": [
      0.1,
      0.3,
      0.6
    ],
    "minAnsweredRatio": 0.8,
    "minFunctionItems": 2
  },
  "modes": {
    "quick": {
      "dimensions": {
        "min": 4,
        "max": 8,
        "total": 24
      },
      "functions": {
        "per": 2
      },
      "adaptive": true
    },
    "normal": {
      "dimensions": {
        "min": 9,
        "max": 15,
        "total": 48
      },
      "functions": {
        "per": 4
      },
      "adaptive": true
    },
    "senior": {
      "dimensions": {
        "min": 16,
        "max": 24,
        "total": 80
      },
      "functions": {
        "per": 8
      },
      "adaptive": true
    },
    "full": {
      "all": true,
      "adaptive": false
    }
  },
  "items": [
    {
      "id": "EI-001",
      "target": "EI",
      "key": 1,
      "weight": 1,
      "scale": "likert7",
      "text": {
        "zh-CN": "在热闹的聚会结束后，我通常觉得精力更充沛了。",
        "en": "After a lively gathering, I usually feel more energized than before."
      },
      "tags": [
        "energy"
      ],
      "enabled": true
    },
    {
      "id": "EI-002",
      "target": "EI",
      "key": 1,
      "weight": 1,
      "scale": "likert7",
      "text": {
        "zh-CN": "我喜欢边说边想，把想法讲出来能帮我理清思路。",
        "en": "I like to think out loud; talking helps me sort out my thoughts."
      },
      "tags": [
        "thinking"
      ],
      "enabled": true
    },
    {
      "id": "EI-003",
      "target": "EI",
      "key": 1,
      "weight": 1,
      "scale": "likert7",
      "text": {
        "zh-CN": "在一群不太熟的人中，我通常会主动开启话题。",
        "en": "Among people I don't know well, I usually start the conversation."
      },
      "tags": [
        "initiative"
      ],
      "enabled": true
    },
    {
      "id": "EI-004",
      "target": "EI",
      "key": 1,
      "weight": 1,
      "scale": "likert7",
      "text": {
        "zh-CN": "空闲的周末，我更愿意约朋友出去而不是待在家里。",
        "en": "On a free weekend, I would rather go out with friends than stay at home."
      },
      "tags": [
        "leisure"
      ],
      "enabled": true
    },
    {
      "id": "EI-005",
      "target": "EI",
      "key": 1,
      "weight": 1,
      "scale": "likert7",
      "text": {
        "zh-CN": "我喜欢同时认识很多不同的人。",
        "en": "I enjoy getting to know many different people at the same time."
      },
      "tags": [
        "breadth"
      ],
      "enabled": true
    },
    {
      "id": "EI-006",
      "target": "EI",
      "key": 1,
      "weight": 1,
      "scale": "likert7",
      "text": {
        "zh-CN": "小组讨论时，我通常是比较早发言的人之一。",
        "en": "In group discussions, I am usually one of the first to speak."
      },
      "tags": [
        "speaking"
      ],
      "enabled": true
    },
    {
      "id": "EI-007",
      "target": "EI",
      "key": 1,
      "weight": 1,
      "scale": "likert7",
      "text": {
        "zh-CN": "一个人独处太久会让我觉得闷。",
        "en": "Spending a long time alone makes me feel restless."
      },
      "tags": [
        "energy"
      ],
      "enabled": true
    },
    {
      "id": "EI-008",
      "target": "EI",
      "key": 1,
      "weight": 1,
      "scale": "likert7",
      "text": {
        "zh-CN": "我很享受成为大家注意力的中心。",
        "en": "I enjoy being the center of attention."
      },
      "tags": [
        "attention"
      ],
      "enabled": true
    },
    {
      "id": "EI-009",
      "target": "EI",
      "key": 1,
      "weight": 1,
      "scale": "likert7",
      "text": {
        "zh-CN": "遇到问题时，我倾向于先找人聊聊。",
        "en": "When I face a problem, my first move is usually to talk it through with someone."
      },
      "tags": [
        "thinking"
      ],
      "enabled": true
    },
    {
      "id": "EI-010",
      "target": "EI",
      "key": 1,
      "weight": 1,
      "scale": "likert7",
      "text": {
        "zh-CN": "我在热闹、有人来往的环境中做事效率更高。",
        "en": "I get more done in a lively place with people coming and going."
      },
      "tags": [
        "environment"
      ],
      "enabled": true
    },
    {
      "id": "EI-011",
      "target": "EI",
      "key": 1,
      "weight": 1,
      "scale": "likert7",
      "text": {
        "zh-CN": "别人通常很快就能知道我在想什么。",
        "en": "People usually find out quickly what I am thinking."
      },
      "tags": [
        "openness"
      ],
      "enabled": true
    },
    {
      "id": "EI-012",
      "target": "EI",
      "key": 1,
      "weight": 1,
      "scale": "likert7",
      "text": {
        "zh-CN": "我很容易和陌生人聊起来。",
        "en": "I find it easy to strike up a chat with strangers."
      },
      "tags": [
        "initiative"
      ],
      "enabled": true
    },
    {
      "id": "EI-013",
      "target": "EI",
      "key": 1,
      "weight": 1,
      "scale": "likert7",
      "text": {
        "zh-CN": "一天中如果有很多社交活动，我反而感到更有活力。",
        "en": "A day full of social activities leaves me feeling more lively, not less."
      },
      "tags": [
        "energy"
      ],
      "enabled": true
    },
    {
      "id": "EI-014",
      "target": "EI",
      "key": 1,
      "weight": 1,
      "scale": "likert7",
      "text": {
        "zh-CN": "我更喜欢通过参与和行动来了解一件事，而不是先在心里想清楚。",
        "en": "I prefer to understand things by jumping in and taking part rather than thinking them through first."
      },
      "tags": [
        "action"
      ],
      "enabled": true
    },
    {
      "id": "EI-015",
      "target": "EI",
      "key": 1,
      "weight": 1,
      "scale": "likert7",
      "text": {
        "zh-CN": "加入一个新团体时，我很快就能融入。",
        "en": "When I join a new group, I fit in quickly."
      },
      "tags": [
        "groups"
      ],
      "enabled": true
    },
    {
      "id": "EI-016",
      "target": "EI",
      "key": -1,
      "weight": 1,
      "scale": "likert7",
      "text": {
        "zh-CN": "和很多人相处一整天后，我需要独处一段时间来恢复精力。",
        "en": "After a full day with many people, I need time alone to recharge."
      },
      "tags": [
        "energy"
      ],
      "enabled": true
    },
    {
      "id": "EI-017",
      "target": "EI",
      "key": -1,
      "weight": 1,
      "scale": "likert7",
      "text": {
        "zh-CN": "比起参加大型聚会，我更喜欢和一两个好朋友深入交谈。",
        "en": "I prefer deep conversations with one or two close friends to big parties."
      },
      "tags": [
        "depth"
      ],
      "enabled": true
    },
    {
      "id": "EI-018",
      "target": "EI",
      "key": -1,
      "weight": 1,
      "scale": "likert7",
      "text": {
        "zh-CN": "发言之前，我通常会先在心里把想法想清楚。",
        "en": "Before speaking, I usually think my ideas through in my head."
      },
      "tags": [
        "thinking"
      ],
      "enabled": true
    },
    {
      "id": "EI-019",
      "target": "EI",
      "key": -1,
      "weight": 1,
      "scale": "likert7",
      "text": {
        "zh-CN": "我习惯先自己消化情绪和想法，再决定要不要跟别人说。",
        "en": "I usually process my feelings and thoughts on my own before deciding whether to share them."
      },
      "tags": [
        "processing"
      ],
      "enabled": true
    },
    {
      "id": "EI-020",
      "target": "EI",
      "key": -1,
      "weight": 1,
      "scale": "likert7",
      "text": {
        "zh-CN": "电话突然响起时，我常常希望对方改发消息。",
        "en": "When the phone rings unexpectedly, I often wish the person had sent a message instead."
      },
      "tags": [
        "contact"
      ],
      "enabled": true
    },
    {
      "id": "EI-021",
      "target": "EI",
      "key": -1,
      "weight": 1,
      "scale": "likert7",
      "text": {
        "zh-CN": "在会议上，我常常是听得多、说得少的那个人。",
        "en": "In meetings, I am often the one who listens more than talks."
      },
      "tags": [
        "speaking"
      ],
      "enabled": true
    },
    {
      "id": "EI-022",
      "target": "EI",
      "key": -1,
      "weight": 1,
      "scale": "likert7",
      "text": {
        "zh-CN": "别人需要相处一段时间才能真正了解我。",
        "en": "It takes people a while to really get to know me."
      },
      "tags": [
        "openness"
      ],
      "enabled": true
    },
    {
      "id": "EI-023",
      "target": "EI",
      "key": -1,
      "weight": 1,
      "scale": "likert7",
      "text": {
        "zh-CN": "太多的社交安排会让我感到疲惫。",
        "en": "Too many social plans wear me out."
      },
      "tags": [
        "energy"
      ],
      "enabled": true
    },
    {
      "id": "EI-024",
      "target": "EI",
      "key": -1,
      "weight": 1,
      "scale": "likert7",
      "text": {
        "zh-CN": "我更愿意用文字来表达复杂的想法。",
        "en": "I prefer to express complicated ideas in writing."
      },
      "tags": [
        "expression"
      ],
      "enabled": true
    },
    {
      "id": "EI-025",
      "target": "EI",
      "key": -1,
      "weight": 1,
      "scale": "likert7",
      "text": {
        "zh-CN": "我的朋友圈子不大，但关系都很深。",
        "en": "My circle of friends is small, but the bonds are deep."
      },
      "tags": [
        "depth"
      ],
      "enabled": true
    },
    {